1/9/23 10:35 AM;Jair Messias Bolsonaro;MAIS SOBRE 2019-2022:1- Extinção de 27 mil cargos2- Privatização CODESA (Portos) (1• na história / Espírito Santo)3- Programa Pró-Trilhos (recuperação histórica com iniciativa privada)4- CNH 40 pontos5- Marco do Gás (imposto federal zerado sob o gás de cozinha)6- Privatização da BR Distribuidora e Gaspetro7- Início da Privatização dos Correios8- Encaminhamento da Privatização TAG (Petrobras)9- Privatização da Companhia Energética Manauara e Termoelétrica Potiguar10- Digitalização recorde de Serviços (Reconhecimento mundial)11-  CNH 10 Anos12- mais de 80 Leilões / Ministério da Infraestrutura.13- De 124ª para 65ª no Ranking Doing Business do Banco Mundial14- Projeto de Desestatização de Portos (menos estado e interferência política na logística do dinheiro do contribuinte)15- TranformaGov - Moderniza a Gestão da Administração Pública (menos gastos ao povo e estado)16- Auxílio-Emergencial (R$ 600,00) “fecha tudo”17- Venda/Transferência de Veículos por meio Digital (economia e tempo)18- Programa de Apoio à Elaboração de Planos de Mobilidade Urbana Municipais (investimento direito nas cidades)19- Programa Brasil M.A.I.S - Apoio de perícias, investigações e operações policiais (ex: expansão recorde do Banco Nacional de perfis genéticos para soluções de crimes)20- Programa Guardiões do Bioma (recordes de aplicações de recursos e operações no combate aos crimes ambientais)21- Marco do câmbio (aumento do limite de $10.000 em viagens / redução gradativa do IOF)22- Leilão 5G (tecnologia e desenvolvimento)23- Mais 231 mil moradias no Nordeste24- FMI: Realocação Inteligente de Recursos Pandemia25- Endividamento Patamar Pré-Pandemia (contas do Governo fecharam no azul após 9 anos no vermelho)26- Marco da Cabotagem (BR do Mar)27- DTe Caminhoneiros (desburocratizações e economia ao usuário)28- mais 1000 Obras de Infraestruturas Turísticas Concluídas29- Convite OCDE30- Disque Direitos Humanos (Disque 100)31- Central de Atendimento à Mulher (Disque 180)32- Nova Lei Rouneat (encaminhamento de recursos para quem realmente necessita)33- Programa Lixão Zero (mais de 800 lixões fechados e ordenamento para reciclagem)34- Programa Wi-Fi Brasil (14,5 mil pontos) (escolas, hospitais e locais públicos)35- 130 Escolas Cívico-Militares36- mais de 2.500 Obras Escolares37- Revogaço (23 mil atos revogados);99095.0;11248.0;129703.0;;;211857482296579;211857482296579_795886141888809;https://www.facebook.com/522422702568489/posts/795886141888809;
1/8/23 9:21 PM;Jair Messias Bolsonaro;-;138777.0;17644.0;182865.0;;;211857482296579;211857482296579_795525845258172;https://www.facebook.com/522422702568489/posts/795525845258172;
1/8/23 11:40 AM;Jair Messias Bolsonaro; Em quatro anos, o Ministério da Infraestrutura do Governo Jair Bolsonaro conclui 364 obras e garante cerca de R$ 117 bilhões para infraestrutura de transportes.- Aplicação de recursos públicos e contratação de investimentos privados asseguram modernização da logística nacional de transporte em todo o Brasil e geram 2 milhões de novos empregos nos próximos anos.;80312.0;8960.0;102936.0;;;211857482296579;211857482296579_795228825287874;https://www.facebook.com/522422702568489/posts/795228825287874;
1/7/23 9:55 AM;Jair Messias Bolsonaro; Recorde de Vendas de Imóveis da União (menos gastos, direcionando para investimento onde interessa ao povo e responsabilidade com os recursos do contribuinte).- Desde que o Governo Jair Bolsonaro (PL) assumiu até 2022 foram vendidos mais de 250 imóveis da União, que totalizaram mais de R$ 700 milhões.- É uma alta de 93% na comparação com os ex-presidentes Michel Temer (MDB) e 72% com Dilma Rousseff (PT).;88522.0;7451.0;109744.0;;;211857482296579;211857482296579_794403915370365;https://www.facebook.com/522422702568489/posts/794403915370365;
1/6/23 7:44 AM;Jair Messias Bolsonaro; A maior fábrica de Grafeno da América Latina! É o Brasil saindo na frente!- Maior parque de produção em escala industrial de grafeno na América Latina, a UCSGRAPHENE é vinculada à Universidade de Caxias do Sul (UCS) e atua nos campos de pesquisa, desenvolvimento e inovação com a finalidade de utilizar o grafeno para atender as demandas da indústria nacional. - Em 2021, uma portaria do Ministério da Ciência, Tecnologia e Inovações instituiu o programa Inova Grafeno e parceria para tornar a UCSGRAPHENE uma unidade EMBRAPII, organização social do MCTI. - A portaria prevê o desenvolvimento de nanocompósitos poliméricos com grafeno para aplicação em tratamentos cutâneos e medicina regenerativa com apoio da FINEP.- O grafeno tem incríveis propriedades físicas, além de ser o mais leve e fino material existente, é 200 vezes mais forte do que o aço e considerado o melhor material condutor de calor e de eletricidade. - O Brasil é um dos países com maior reserva de grafite, fonte do grafeno, ao lado da China e do Canadá.;77887.0;6612.0;97998.0;;;211857482296579;211857482296579_793661868777903;https://www.facebook.com/522422702568489/posts/793661868777903;
1/5/23 8:53 AM;Jair Messias Bolsonaro; No final de 2022, assinamos MP que mantém a garantia da isenção do DPVAT 2023 beneficiando milhões de motoristas brasileiros.. Detalhes em nosso Telegram: “Jair M. Bolsonaro 1”;114792.0;10532.0;146239.0;;;211857482296579;211857482296579_792983005512456;https://www.facebook.com/522422702568489/posts/792983005512456;
1/4/23 9:53 AM;Jair Messias Bolsonaro; Em dezembro de 2022 sancionamos o Projeto de Lei que regulamenta a prática de telessaúde em todo território nacional.- Medida possibilitará intensificar o acompanhamento remoto de pacientes e ampliar o acesso ao atendimento médico.- A telemedicina aparece como alternativa para permitir o acesso de mais pacientes ao sistema de saúde (seja público ou privado).- Alcançar territórios mais distantes, otimizar a utilização de mão-de-obra especializada, evitar desperdício de recursos, intensificar o acompanhamento remoto de pacientes, facilitar triagens para evitar superlotação desnecessária e o oferecimento de opções de atendimento de saúde virtual possa aumentar o acesso das populações aos serviços de saúde.. Detalhes em nosso canal no Telegram: “Jair M. Bolsonaro 1”;107902.0;13914.0;141710.0;;;211857482296579;211857482296579_792310842246339;https://www.facebook.com/522422702568489/posts/792310842246339;
1/3/23 9:35 AM;Jair Messias Bolsonaro; GOVERNO JAIR BOLSONARO ANUNCIA REDUÇÃO DE 38,9% NA TARIFA DE ITAIPU PARA 2023: No  final de 2022, O Ministério de Minas e Energia do Governo Jair Bolsonaro anunciou a tarifa de Itaipu para 2023: US$ 12,67/kW. O valor representa uma redução de 38,9% em relação a 2022 (US$ 20,75/kW) e de 43,9% em comparação com o valor de 2019 (US$ 22,60/kW), pago pelos consumidores desde 2009.- os fatos representam uma redução de mais de R$ 9 bilhões na conta paga pelos consumidores da energia gerada pela usina e destacam o compromisso em garantir aos consumidores brasileiros energia limpa, segura e barata.- Além disso, a nova tarifa reflete a redução do serviço da dívida da usina e do Custo Unitário dos Serviços de Eletricidade (Cuse). Em 2019, a dívida de Itaipu era de US$ 2,07 bilhões. Em 2023, cairá para US$ 277,3 milhões.;144197.0;20977.0;196402.0;;;211857482296579;211857482296579_791597922317631;https://www.facebook.com/522422702568489/posts/791597922317631;
1/2/23 11:13 AM;Jair Messias Bolsonaro;1.1- NOVO CAGED: Brasil tem novo recorde histórico de empregos formais no pais: 43,1 milhões.1.2- BALANÇO 2022: Secretaria Especial do PPI concluiu 48 projetos em 2022 e assegurou R$ 101 bilhões em novos investimentos.SEPPI esteve presente na capitalização da Eletrobras, em concessões de aeroportos e reforçou apoio a estados e municípios ao longo do ano.1.3- BALANÇO 2022: Governo Federal investiu mais de R$ 540 bilhões para o enfrentamento da pandemia no Brasil.Ministério da Saúde aplicou mais de R$ 38 bilhões para aquisição de vacinas.1.4- ÁGUA NO NORDESTE: Desde 2019, Governo Federal investiu mais de R$ 4,7 bilhões para ampliar oferta de água no Nordeste.Nos últimos quatro anos, MDR concluiu o Eixo Norte da Transposição do São Francisco, levando as águas do Velho Chico, pela primeira vez, ao Ceará e ao Rio Grande do Norte.;161715.0;17977.0;211025.0;;;211857482296579;211857482296579_790920079052082;https://www.facebook.com/522422702568489/posts/790920079052082;
1/1/23 9:34 AM;Jair Messias Bolsonaro; Siga-nos no Kwai: https://kwai-video.com/u/@jairbolsonaro/F6FXCZXz;82819.0;13661.0;113556.0;;;211857482296579;211857482296579_790016259142464;https://www.facebook.com/522422702568489/posts/790016259142464;
12/31/22 1:54 PM;Jair Messias Bolsonaro;-;76614.0;13026.0;114988.0;;;211857482296579;211857482296579_789153082562115;https://www.facebook.com/522422702568489/posts/789153082562115;
12/31/22 10:02 AM;Jair Messias Bolsonaro;Papa Bento XVI- Recebi, com grande pesar, a notícia do falecimento do Papa (emérito) Bento XVI.- Embora seu pontificado tenha sido curto, deixa um legado imenso para a Igreja católica, para todos os cristãos e para a humanidade.- Orientou sua missão pelo lema: “Cooperadores da Verdade”. Foi um servidor dedicado da Verdade e da boa doutrina.- Em defesa da verdade do Evangelho, criticou sem medo os erros da chamada “teologia da libertação”, que pretende confundir o Cristianismo com conceitos equivocados do marxismo.- O Papa Bento, ao contrário, fundamentou  todos os seus escritos e ensinamentos na Verdade que liberta (João, 8,32).- Que seu exemplo e sua obra magistral de grande teólogo e Pastor possam educar e iluminar a todos nós.";55545.0;3557.0;69752.0;;;211857482296579;211857482296579_788880185922738;https://www.facebook.com/522422702568489/posts/788880185922738;
12/30/22 10:17 AM;Jair Messias Bolsonaro; Prestação de conta e atual momento político brasileiro:;261023.0;247058.0;643212.0;;;211857482296579;211857482296579_1109039999734715;https://www.facebook.com/522422702568489/videos/1109039999734715;
12/30/22 8:53 AM;Jair Messias Bolsonaro;Hoje, os números de títulos de propriedade ultrapassam os 420 mil, possibilitando historicamente ao pequeno agricultor a entrada na logística de renda na produção da agricultura familiar.;73626.0;8027.0;97361.0;;;211857482296579;211857482296579_787962926014464;https://www.facebook.com/522422702568489/posts/787962926014464;
12/29/22 7:44 PM;Jair Messias Bolsonaro; Com pesar o passamento de um homem, que pelo futebol, levou o nome do Brasil para o mundo. Transformou o futebol em arte e alegria.- Que Deus conforte sua família e que o acolha na sua infinita misericórdia.;165081.0;5427.0;197244.0;;;211857482296579;211857482296579_787606236050133;https://www.facebook.com/522422702568489/posts/787606236050133;
12/29/22 9:23 AM;Jair Messias Bolsonaro; Menos impostos, maior capacidade de arrecadação e retorno para o povo!;107572.0;9174.0;149867.0;;;211857482296579;211857482296579_787268092750614;https://www.facebook.com/522422702568489/posts/787268092750614;
12/28/22 11:29 AM;Jair Messias Bolsonaro;-;84893.0;12181.0;127401.0;;;211857482296579;211857482296579_786654912811932;https://www.facebook.com/522422702568489/posts/786654912811932;
12/27/22 8:29 AM;Jair Messias Bolsonaro; TRANSPOSIÇÃO DO RIO SÃO FRANCISCO / PERNAMBUCO: bombeamento do Eixo Norte funcionando a todo VAPOR.;80916.0;9738.0;111994.0;;;211857482296579;211857482296579_785828806227876;https://www.facebook.com/522422702568489/posts/785828806227876;
12/26/22 8:30 AM;Jair Messias Bolsonaro; PREÇO DA GASOLINA CAI NO BRASIL PELA QUINTA SEMANA CONSECUTIVA:- A Agência Nacional do Petróleo, Gás Natural e Biocombustíveis (ANP) anunciou a quinta redução seguida no preço da gasolina.- O relatório da agência é divulgado semanalmente e, desta vez, a queda foi de 0,20% nas bombas.- Lembrando que graças a fixação nacional do ICMS cobrado nos estados sob o valor dos combustíveis, telefonia móvel, internet e energia elétrica o valor do litro dos combustíveis ao consumidor vem caindo e consequentemente toda a linha de logística até chegar na redução do preço dos alimentos na mesa da família do Brasileiro.- Vitória esta conseguida mesmo com o voto contrário de parlamentares do PT, bem como a reprovação da redução de impostos por lula.- Frisamos que também zeramos o imposto de produtos da cesta básica assim como permanentemente o imposto federal do gás de cozinha.- Por fim, mesmo com a redução do ICMS a arrecadação bate recorde histórico no país.;199395.0;25743.0;261331.0;;;211857482296579;211857482296579_785129412964482;https://www.facebook.com/522422702568489/posts/785129412964482;
12/25/22 1:18 PM;Jair Messias Bolsonaro;-;99817.0;11907.0;142675.0;;;211857482296579;211857482296579_784572053020218;https://www.facebook.com/522422702568489/posts/784572053020218;
12/22/22 9:14 AM;Jair Messias Bolsonaro;-;98164.0;19753.0;153083.0;;;211857482296579;211857482296579_782077229936367;https://www.facebook.com/522422702568489/posts/782077229936367;
12/19/22 7:30 PM;Jair Messias Bolsonaro; Inscreva-se: https://t.me/jairbolsonarobrasil;74998.0;11394.0;100370.0;;;211857482296579;211857482296579_780049843472439;https://www.facebook.com/522422702568489/posts/780049843472439;
12/12/22 5:40 PM;Jair Messias Bolsonaro; Palácio do Alvorada / 12DEZ22. Notícias atualizadas diariamente em nosso Telegram:  https://t.me/jairbolsonarobrasil;296822.0;264652.0;756893.0;;;211857482296579;211857482296579_570369834925945;https://www.facebook.com/522422702568489/videos/570369834925945;
12/11/22 5:53 PM;Jair Messias Bolsonaro; Jardim do Alvorada (11/11/2022). Inscreva-se em nosso LinkedIn: https://www.linkedin.com/in/jairmessiasbolsonaro;371448.0;279875.0;886478.0;;;211857482296579;211857482296579_861129775242385;https://www.facebook.com/522422702568489/videos/861129775242385;
12/11/22 12:20 PM;Jair Messias Bolsonaro; Atualizações todos os dias:. Telegram: https://t.me/jairbolsonarobrasil. GETTR: https://gettr.com/user/jairbolsonaro. TikTok: bityli.com/xHIFePiGZ. LinkedIn: bityli.com/rKlqanwk. Kwai: bityli.com/yxpMfKoEk. Aplicativo: https://app.bolsonaro.tv/. YouTube: https://youtube.com/@jbolsonaro;18408.0;2902.0;23031.0;;;211857482296579;211857482296579_772514317559325;https://www.facebook.com/522422702568489/posts/772514317559325;
12/8/22 7:12 AM;Jair Messias Bolsonaro;-;362775.0;62129.0;488805.0;;;211857482296579;211857482296579_769807174496706;https://www.facebook.com/522422702568489/posts/769807174496706;
12/7/22 7:22 AM;Jair Messias Bolsonaro; Parabéns por seu aniversário! Um forte abraço, Garoto! Carlos Bolsonaro;307031.0;59310.0;411932.0;;;211857482296579;211857482296579_768990147911742;https://www.facebook.com/522422702568489/posts/768990147911742;
12/4/22 11:56 AM;Jair Messias Bolsonaro;-;301985.0;23484.0;382167.0;;;211857482296579;211857482296579_766942374783186;https://www.facebook.com/522422702568489/posts/766942374783186;
12/2/22 9:35 AM;Jair Messias Bolsonaro;-;146859.0;10968.0;185377.0;;;211857482296579;211857482296579_765313714946052;https://www.facebook.com/522422702568489/posts/765313714946052;
12/1/22 10:19 AM;Jair Messias Bolsonaro;-;236506.0;31130.0;311147.0;;;211857482296579;211857482296579_764529761691114;https://www.facebook.com/522422702568489/posts/764529761691114;
11/29/22 10:27 AM;Jair Messias Bolsonaro;-;275644.0;49728.0;379736.0;;;211857482296579;211857482296579_762919015185522;https://www.facebook.com/522422702568489/posts/762919015185522;
11/16/22 1:13 PM;Jair Messias Bolsonaro; Publicações atualizadas diariamente:. Telegram: https://t.me/jairbolsonarobrasil. GETTR: https://gettr.com/user/jairbolsonaro. TikTok: https://bityli.com/xHIFePiGZ. LinkedIn: https://bityli.com/rKlqanwk. Kwai: https://bityli.com/yxpMfKoEk. Aplicativo: https://app.bolsonaro.tv/;70354.0;16927.0;99133.0;;;211857482296579;211857482296579_753652186112205;https://www.facebook.com/522422702568489/posts/753652186112205;
11/8/22 12:46 PM;Jair Messias Bolsonaro;-;294183.0;58168.0;446526.0;;;211857482296579;211857482296579_747766070034150;https://www.facebook.com/522422702568489/posts/747766070034150;
11/2/22 7:17 PM;Jair Messias Bolsonaro; Presidente Jair Bolsonaro pede a manifestantes que desobstruam as rodovias.;681946.0;143895.0;1072920.0;;;211857482296579;211857482296579_742586723885418;https://www.facebook.com/522422702568489/posts/742586723885418;
11/1/22 4:36 PM;Jair Messias Bolsonaro;Pronunciamento PR 01NOV22;392017.0;150526.0;733035.0;;;211857482296579;211857482296579_532471931551394;https://www.facebook.com/522422702568489/videos/532471931551394;
10/29/22 11:59 PM;Jair Messias Bolsonaro;"Vistam toda a armadura de Deus, para poderem ficar firmes contra as ciladas do Diabo, pois a nossa luta não é contra humanos, mas contra os poderes e autoridades, contra os dominadores deste mundo de trevas..." Efésios 6:11-12- QUE DEUS ABENCOE O NOSSO AMADO BRASIL! 🇧🇷;434320.0;111816.0;716161.0;;;211857482296579;211857482296579_737980491012708;https://www.facebook.com/522422702568489/posts/737980491012708;
10/29/22 11:12 PM;Jair Messias Bolsonaro; Meu obrigado a Donald Trump pelo apoio! Sinto orgulho por ver que nosso trabalho por um Brasil mais seguro e mais livre é respeitado no mundo todo e que, hoje, contamos com o apoio de nações democráticas e não de ditaduras socialistas como no passado. Que a liberdade prevaleça!;169128.0;11732.0;230077.0;;;211857482296579;211857482296579_737954751015282;https://www.facebook.com/522422702568489/posts/737954751015282;
10/29/22 9:57 PM;Jair Messias Bolsonaro; Para Lula os MEIs não trabalham.;98177.0;10614.0;161666.0;;;211857482296579;211857482296579_737906517686772;https://www.facebook.com/522422702568489/posts/737906517686772;
10/29/22 7:15 PM;Jair Messias Bolsonaro; É preciso compreender aqueles que ainda não decidiram e lhes oferecer segurança para que façam a melhor escolha para o futuro da nossa nação. Mais do que promessas vazias e abstratas, o Brasil precisa de um caminho sólido, pautado em ações concretas e, sobretudo, em princípios.- A partir de 2023, com um Congresso em sintonia com o nosso Governo, será possível avançar não apenas em novas propostas, mas naquelas boas medidas que foram travadas pelo caminho. Dito isso segue abaixo 22 COMPROMISSOS que farão do Brasil um país mais próspero, mais livre e mais seguro para todos os brasileiros:1. Reduzir maioridade penal para crimes hediondos, como estupro, homicídio e latrocínio.2. Acabar com a audiência de custódia, hoje um dos maiores estímulos à impunidade no país.3. Endurecer penas para crimes violentos e os critérios para progressão deregime.4. Criar o Estatuto de Direitos das Vítimas, em contrapartida à crescente inversão de valores percebida nas últimas décadas, onde o bandido é a vítima e a polícia e os cidadãos são os vilões.5. Garantir retaguarda jurídica e excludente de ilicitude para agentes de segurança, respaldando nossos policiais no combate ao crime.6. Aumentar o Fundo Nacional de Segurança Pública para garantir a aparelhagem e a modernização das forças de segurança.7. Com as medidas de combate à impunidade apresentadas acima, buscaremos reduzir em mais 20% os homicídios nos próximos 4 anos, chegando a uma queda de 50% do pico de mortes violentas atingido no último ano de governo do PT.8. Implementar uma Política Nacional de Fortalecimento dos Laços Familiares, um conjunto de medidas e diretrizes que visam incentivar a criação e preservação das famílias, que são a base da sociedade.9. Garantir o bônus de produtividade de 200 reais adicionais para beneficiários do Auxílio Brasil permanente de no mínimo 600 reais, para estimular o trabalho produtividade e a ascensão dos mais pobres.10. Entregar no mínimo mais 2 milhões de moradias a famílias de baixa renda.11. Democratizar os serviços digitais, por meio da isenção de impostos para compra de aparelhos celulares populares e do estabelecimento de uma tarifa social para planos de dados.12. Aumentar o salário mínimo para 1400 reais em 2023 e acima da inflação todos os anos até 2026.13. Seguir indicando de forma independente nomes técnicos e de Ficha Limpa para Ministérios, bancos públicos e estatais, impedindo que interesses escusos façam florescer a corrupção sistêmica no Governo.14. Manter uma política econômica pautada no livre mercado e na responsabilidade fiscal, propiciando um ambiente favorável à atração de investimentos e à geração de pelo menos mais 6 milhões de empregos.15. Criar e implementar o SUS Online: Modernização dos serviços de saúde pública, com agendamento, pré-triagem e prontuário digital, visando reduzir e zerar as filas nos hospitais (Zap da Saúde).16. Promover a desoneração da folha de pagamento para profissionais de saúde e buscar a desoneração gradual para os demais profissionais.17. Corrigir Tabela do IRPF, com isenção para quem ganha até cinco salários mínimos, e implementar o IRPF familiar, que permite um imposto de renda menor para quem realizar a declaração em família.18. Fazer do Nordeste o centro mundial de geração de energia verde e converter os royalties em benefícios sociais para a população, como o Auxílio Brasil.19. Implementar o FIES/TEC, para financiar cursos técnicos e profissionalizantes, permitindo aos brasileiros uma inserção maior no mercado de trabalho e um retorno financeiro mais rápido ao estudante.20. Implementar o Programa Educação para o Futuro, que pretende, com base no sucesso que tivemos com os cursos de alfabetização, disponibilizar para a população também o ensino de Programação, Inglês e Educação Financeira, essenciais para o crescimento profissional.21. Não controlar nem interferir na imprensa e preservar a liberdade de expressão, inclusive na Internet.22. Não ampliar o número de ministros do Supremo Tribunal Federal, indicar ministros comprometidos com a Proteção da Vida desde a concepção e a Liberdade, e respeitar a independência entre os poderes e a Constituição Federal, a nossa Carta da Democracia.- Existe muito mais além. Reconstruir um país continental e que foi abandonado por décadas demanda tempo e muito esforço. Mas hoje posso garantir que somos capazes de alcançar os nossos  objetivos e finalmente transformar o Brasil na nação que sempre sonhamos. Até a vitória!- BRASIL ACIMA DE TUDO, DEUS ACIMA DE TODOS! 🇧🇷;119387.0;16687.0;185315.0;;;211857482296579;211857482296579_737521371058620;https://www.facebook.com/522422702568489/posts/737521371058620;
10/29/22 6:36 PM;Jair Messias Bolsonaro;-;52419.0;5315.0;71743.0;;;211857482296579;211857482296579_737400491070708;https://www.facebook.com/522422702568489/posts/737400491070708;
10/29/22 4:14 PM;Jair Messias Bolsonaro; Belo Horizonte/MG.- Presidente Jair Bolsonaro.- Obrigado Minas Gerais.- Sábado, 29/outubro.- Os vovôs, as vovós e os nossos jovens serão decisivos amanhã, assim como as tias do zap.;84323.0;9393.0;119443.0;;;211857482296579;211857482296579_737329351077822;https://www.facebook.com/522422702568489/posts/737329351077822;
10/29/22 1:02 PM;Jair Messias Bolsonaro;-;81735.0;11585.0;156470.0;;;211857482296579;211857482296579_737153874428703;https://www.facebook.com/522422702568489/posts/737153874428703;
10/29/22 12:17 PM;Jair Messias Bolsonaro; Belo Horizonte / Minas Gerais (29/10) 8. Nosso Kwai: http://s.kw.ai/u/@jairbolsonaro/h7AEC173;45045.0;8144.0;69138.0;;;211857482296579;211857482296579_1304535603704986;https://www.facebook.com/522422702568489/videos/1304535603704986;
10/29/22 11:57 AM;Jair Messias Bolsonaro; Belo Horizonte / Minas Gerais (29/10) 7. Nosso TikTok: https://www.tiktok.com/@bolsonaromessiasjair?_t=8WueqAPHzYD&_r=1;83317.0;20845.0;138094.0;;;211857482296579;211857482296579_696550178144617;https://www.facebook.com/522422702568489/videos/696550178144617;
10/29/22 11:26 AM;Jair Messias Bolsonaro; Belo Horizonte / Minas Gerais (29/10) 6. Baixe nosso Aplicativo: https://app.bolsonaro.tv/;52221.0;11180.0;79861.0;;;211857482296579;211857482296579_1201485157072657;https://www.facebook.com/522422702568489/videos/1201485157072657;
10/29/22 11:09 AM;Jair Messias Bolsonaro; Belo Horizonte / Minas Gerais (29/10) 5. Nosso site: www.bolsonaro.tv;42549.0;9156.0;64728.0;;;211857482296579;211857482296579_2257083374459381;https://www.facebook.com/522422702568489/videos/2257083374459381;
10/29/22 11:01 AM;Jair Messias Bolsonaro; Belo Horizonte / Minas Gerais (29/10) 4. Nosso Telegram: https://t.me/jairbolsonarobrasil;30436.0;3808.0;42816.0;;;211857482296579;211857482296579_1055837091779638;https://www.facebook.com/522422702568489/videos/1055837091779638;
10/29/22 10:52 AM;Jair Messias Bolsonaro; Belo Horizonte / Minas Gerais (29/10) 3. Nosso Flickr: https://www.flickr.com/photos/fotosbolsonaro/;212258.0;57675.0;384809.0;;;211857482296579;211857482296579_420756913403664;https://www.facebook.com/522422702568489/videos/420756913403664;
10/29/22 10:42 AM;Jair Messias Bolsonaro; Belo Horizonte / Minas Gerais (29/10) 2. Nosso GETTR: https://gettr.com/user/jairbolsonaro;54533.0;14590.0;89512.0;;;211857482296579;211857482296579_1988398091353713;https://www.facebook.com/522422702568489/videos/1988398091353713;
10/29/22 10:07 AM;Jair Messias Bolsonaro; Belo Horizonte / Minas Gerais (29/10) 1. Nosso YouTube: https://youtube.com/c/jbolsonaro;41334.0;13042.0;69475.0;;;211857482296579;211857482296579_1223555251851085;https://www.facebook.com/522422702568489/videos/1223555251851085;
10/29/22 8:23 AM;Jair Messias Bolsonaro;-;48856.0;4817.0;75654.0;;;211857482296579;211857482296579_736914584452632;https://www.facebook.com/522422702568489/posts/736914584452632;
