8/25/22 7:34 AM;Jair Messias Bolsonaro; TRANSPOSIÇÃO DO RIO SÃO FRANCISCO: Ceará, Piauí, Alagoas, Rio Grande do Norte, Pernambuco, Paraíba…;42091.0;3951.0;61424.0;;;211857482296579;211857482296579_659311492212942;https://www.facebook.com/522422702568489/posts/659311492212942;
8/24/22 11:32 PM;Jair Messias Bolsonaro; Por incrível que pareça, existem pessoas que acham mais constrangedor palavras descontextualizadas do que apoiar um sujeito que estava preso por promover o maior esquema de corrupção de nossa história e que, junto com sua indicada, quebrou o 🇧🇷 sem pandemia e sem guerra.. Tarcísio Gomes de Freitas;68619.0;6518.0;103422.0;;;211857482296579;211857482296579_659075268903231;https://www.facebook.com/522422702568489/posts/659075268903231;
8/24/22 8:27 PM;Jair Messias Bolsonaro; O Brasil do presente deixou de servir a esses regimes ultrapassados. Hoje servimos ao nosso povo! O dinheiro público, que na verdade é dos brasileiros, quando não devolvido através de reduções de impostos, é usado para desenvolver o nosso país e não mais sustentar ditaduras.;103432.0;7638.0;137273.0;;;211857482296579;211857482296579_658993155578109;https://www.facebook.com/522422702568489/posts/658993155578109;
8/24/22 6:16 PM;Jair Messias Bolsonaro; Belo Horizonte - Minas Gerais (24/08/2022). Nosso perfil no TikTok: https://r.search.yahoo.com/_ylt=AwrEeCvNlwZjUTMA8REf7At.,_ylu=Y29sbwNiZjEEcG9zAzEEdnRpZAMEc2VjA3Ny/RV=2/RE=1661405262/RO=10/RU=https%3a%2f%2fwww.tiktok.com%2f%40bolsonaromessiasjair/RK=2/RS=yzkTbbpSs7aUsSu7lU0jA7w9C88-;1595.0;286.0;2413.0;;;211857482296579;211857482296579_1155221328364271;https://www.facebook.com/522422702568489/videos/1155221328364271;
8/24/22 6:13 PM;Jair Messias Bolsonaro; Belo Horizonte / Minas Gerais (24/08/2022) Parte 7. Baixe nosso Aplicativo:  https://app.bolsonaro.tv/;1585.0;251.0;2306.0;;;211857482296579;211857482296579_582528930265680;https://www.facebook.com/522422702568489/videos/582528930265680;
8/24/22 6:07 PM;Jair Messias Bolsonaro; Belo Horizonte / Minas Gerais (24/08/2022) Parte 6. Nosso LinkedIn: https://br.linkedin.com/in/jairmessiasbolsonaro;1950.0;352.0;3014.0;;;211857482296579;211857482296579_2189362437899041;https://www.facebook.com/522422702568489/videos/2189362437899041;
8/24/22 5:49 PM;Jair Messias Bolsonaro;-;11024.0;1254.0;15060.0;;;211857482296579;211857482296579_1647556525626210;https://www.facebook.com/522422702568489/videos/1647556525626210;
8/24/22 5:45 PM;Jair Messias Bolsonaro; Belo Horizonte / Minas Gerais (24/08/2022) Parte 5. Nosso GETTR: https://gettr.com/user/jairbolsonaro;76005.0;44524.0;163806.0;;;211857482296579;211857482296579_3271876679749794;https://www.facebook.com/522422702568489/videos/3271876679749794;
8/24/22 5:12 PM;Jair Messias Bolsonaro; Belo Horizonte / Minas Gerais (24/08/2022) Parte 4. Baixe nosso Aplicativo:  https://app.bolsonaro.tv/;32421.0;4606.0;47517.0;;;211857482296579;211857482296579_2374482769525341;https://www.facebook.com/522422702568489/videos/2374482769525341;
8/24/22 4:32 PM;Jair Messias Bolsonaro; Belo Horizonte / Minas Gerais (Parte 3) 24/08/2022. Siga nosso Flick com imagens e informações para divulgar entre amigos e familiares: https://r.search.yahoo.com/_ylt=AwrCxnXyjwZjdRoAygkf7At.,_ylu=Y29sbwNiZjEEcG9zAzEEdnRpZAMEc2VjA3Ny/RV=2/RE=1661403251/RO=10/RU=https%3a%2f%2fflickr.com%2fphotos%2ffotosbolsonaro%2f/RK=2/RS=0PeOCuKcfmXpyqVKpd7zrXk9hVk-;34719.0;10801.0;57916.0;;;211857482296579;211857482296579_301228695555438;https://www.facebook.com/522422702568489/videos/301228695555438;
8/24/22 4:28 PM;Jair Messias Bolsonaro; Belo Horizonte / Minas Gerais (Parte 2) 24/08/2022. Siga nosso canal no  YouTube: https://www.youtube.com/user/jbolsonaro;24564.0;6172.0;39983.0;;;211857482296579;211857482296579_1027596431257689;https://www.facebook.com/522422702568489/videos/1027596431257689;
8/24/22 2:40 PM;Jair Messias Bolsonaro;Belo Horizonte / Minas Gerais (Parte 1) 24/08/2022. Atualizações desta quarta-feira realizadas em nosso Telegram: https://t.me/s/jairbolsonarobrasil;52327.0;26198.0;103431.0;;;211857482296579;211857482296579_596032711976263;https://www.facebook.com/522422702568489/videos/596032711976263;
8/24/22 10:11 AM;Jair Messias Bolsonaro; É simples: não sou eu, mas o próprio crime organizado que demonstra enxergar o PT como aliado ao reclamar do meu governo, que tem quebrado recordes de apreensão de drogas e prejuízos às facções, e admitir ter saudades dos diálogos cabulosos com os petistas. Resolvam com o PCC!;60038.0;3971.0;83192.0;;;211857482296579;211857482296579_658030032341088;https://www.facebook.com/522422702568489/posts/658030032341088;
8/24/22 6:52 AM;Jair Messias Bolsonaro; Em mais uma rodada, Famílias de baixa renda de Macapá (AP) e João Pessoa (PB) recebem casa própria.- Mais de 1 milhão de moradias foram entregues desde 2019 em todo o Brasil, priorizando as obras abandonadas como respeito aos recursos do contribuinte.- Empreendimentos contam com infraestrutura completa, drenagem, esgoto, água, pavimentação, energia elétrica, iluminação pública e transporte público.;45678.0;2555.0;56379.0;;;211857482296579;211857482296579_657924299018328;https://www.facebook.com/522422702568489/posts/657924299018328;
8/23/22 11:57 AM;Jair Messias Bolsonaro;-;2667.0;354.0;3585.0;;;211857482296579;211857482296579_585875116354650;https://www.facebook.com/522422702568489/videos/585875116354650;
8/23/22 10:32 AM;Jair Messias Bolsonaro; Congresso Aço Brasil 2022 (São Paulo) 23/08/2022;62534.0;34789.0;124253.0;;;211857482296579;211857482296579_3253136871619390;https://www.facebook.com/522422702568489/videos/3253136871619390;
8/23/22 9:54 AM;Jair Messias Bolsonaro; SERGIPE: o Governo Federal inaugurou ontem o Sistema Integrado de Abastecimento de Água da Adutora do Piauitinga, em Lagarto-SE. Mais de 121 mil pessoas de Lagarto, Simão Dias, Pedrinhas e Riachão dos Dantas terão água nas torneiras de casa.- O investimento federal no sistema de abastecimento de água é de mais de R$ 83,5 milhões. Obras como essa promovem a saúde pública, evitam doenças e reduzem a mortalidade infantil. O abastecimento de água também é essencial para o desenvolvimento econômico e social.- O Sistema de Abastecimento conta com barragem, estações elevatórias de água, estação de tratamento, 45,6 km de adutora, 2 reservatórios, 1,7 km de rede de distribuição e 11,6 mil ligações prediais. Praticamente 10% da população do estado será beneficiada.;45060.0;2613.0;56646.0;;;211857482296579;211857482296579_656316235845801;https://www.facebook.com/522422702568489/posts/656316235845801;
8/23/22 12:41 AM;Jair Messias Bolsonaro; Bastidores Rede Globo. Boa noite a todos! 🇧🇷;165388.0;15386.0;253745.0;;;211857482296579;211857482296579_656039745873450;https://www.facebook.com/522422702568489/posts/656039745873450;
8/22/22 11:14 PM;Jair Messias Bolsonaro; Na ocasião em que Renata diz que sumilei falta de ar por deboche, eu estava DENUNCIANDO o "Protocolo Mandetta", que só recomendava ir ao hospital após sentir falta de ar. Foi justamente o contrário: EU DEFENDI ESSAS PESSOAS. Quem mandou ficar em casa é que desprezou suas vidas!- Sempre defendi que os médicos tivessem autonomia para tratar seus pacientes, bem como que as pessoas procurassem um profissional de forma precoce, assim como é recomendado ao sentir qualquer sintoma de qualquer doença, quando as chances de recuperação são maiores.;173766.0;28081.0;253642.0;;;211857482296579;211857482296579_655988199211938;https://www.facebook.com/522422702568489/posts/655988199211938;
8/22/22 10:22 PM;Jair Messias Bolsonaro; Foi uma enorme satisfação participar do pronunciamento de William Bonner Kkkkk. Na medida do possível, com muita humildade, pudemos esclarecer e levar algumas informações que raramente são noticiadas em sua emissora. Pela paciência e audiência, o meu muito obrigado a todos!;276696.0;40504.0;382782.0;;;211857482296579;211857482296579_655946899216068;https://www.facebook.com/522422702568489/posts/655946899216068;
8/22/22 10:18 PM;Jair Messias Bolsonaro; Batata frita em Marechal Hermes.- Rio/RJ, 22/agosto, 22 hs.;54083.0;4308.0;72267.0;;;211857482296579;211857482296579_655944052549686;https://www.facebook.com/522422702568489/posts/655944052549686;
8/22/22 10:08 PM;Jair Messias Bolsonaro;-;173370.0;21293.0;253721.0;;;211857482296579;211857482296579_655936069217151;https://www.facebook.com/522422702568489/posts/655936069217151;
8/22/22 10:01 PM;Jair Messias Bolsonaro; Obrigado, Anitta!;178312.0;35110.0;293279.0;;;211857482296579;211857482296579_655930142551077;https://www.facebook.com/522422702568489/posts/655930142551077;
8/22/22 9:22 PM;Jair Messias Bolsonaro; Projac (Rio de Janeiro / RJ) 22/08/2022;216083.0;138545.0;486627.0;;;211857482296579;211857482296579_429261942514712;https://www.facebook.com/522422702568489/videos/429261942514712;
8/22/22 7:48 PM;Jair Messias Bolsonaro; Tudo pronto! Daqui a pouco, às 20:30, estarei ao vivo no Jornal Nacional. Nos vemos lá! 👍🇧🇷.;258687.0;41219.0;342335.0;;;211857482296579;211857482296579_655819545895470;https://www.facebook.com/522422702568489/posts/655819545895470;
8/22/22 5:30 PM;Jair Messias Bolsonaro; Se a mídia divulgasse amplamente as reduções de impostos que promovemos desde 2019 ao invés de omitir pra me prejudicar, talvez o autor da charge saberia que nós já reduzimos e zeramos os impostos sobre itens da cesta básica há meses. Ou ele sabe, mas prefere enganar inocentes.;47932.0;3462.0;61314.0;;;211857482296579;211857482296579_655768742567217;https://www.facebook.com/522422702568489/posts/655768742567217;
8/22/22 1:26 PM;Jair Messias Bolsonaro; Nossa política de reduzir impostos continuará! Diferente de quem quer aumentar, já garantimos manter zerados os impostos federais sobre gasolina, diesel, álcool e gás de cozinha em 2023. Desde 2019, já foram reduzidos impostos de diversos itens, incluindo os da cesta básica.;44989.0;3543.0;59178.0;;;211857482296579;211857482296579_655568265920598;https://www.facebook.com/522422702568489/posts/655568265920598;
8/22/22 7:06 AM;Jair Messias Bolsonaro; Graças a legislação de agilização de vendas de bens do tráfico criada neste Governo, em mais uma rodada, foi arrecadado somente no mês de julho, mais de R$12,8 milhões com os 32 leilões realizados pela Secretaria Nacional de Política Sobre Deogas (SENAD).- Foram leiloados imóveis, veículos, e objetos como joias, relógios e até uma prensa hidráulica.. IMÓVEIS: + R$8,3 MILHÕES. VEÍCULOS: + R$3 MILHÕES. OBJETOS DIVERSOS: + R$56MIL- O valor das arrecadações será destinado à sociedade por meio de investimentos na segurança pública, capacitação de profissionais e projetos de combate às drogas em todo o país.;63621.0;4844.0;78746.0;;;211857482296579;211857482296579_655297945947630;https://www.facebook.com/522422702568489/posts/655297945947630;
8/21/22 6:32 PM;Jair Messias Bolsonaro;-;65408.0;5499.0;90114.0;;;211857482296579;211857482296579_654885109322247;https://www.facebook.com/522422702568489/posts/654885109322247;
8/21/22 9:52 AM;Jair Messias Bolsonaro; Após o maior aumento de piso salarial de professores perante série histórica, disponibilizado curso de Formação para Professores do Ensino Fundamental na plataforma Avamec.- O objetivo é ampliar a prática educativa do docente e promover o estudo articulado de competências específicas dos componentes curriculares, como Linguagens e Matemática.- Detalhes em nosso canal no Telegram: “Jair M. Bolsonaro 1”;51569.0;3085.0;62543.0;;;211857482296579;211857482296579_654601806017244;https://www.facebook.com/522422702568489/posts/654601806017244;
8/20/22 9:49 PM;Jair Messias Bolsonaro; Prestigiando, nesta noite de sábado, o show do grande Matheus Ceará em Brasília. Nem o Presidente da República foi poupado kkkkk. Faz parte. Valeu! 👍.;123258.0;3655.0;134352.0;;;211857482296579;211857482296579_654193402724751;https://www.facebook.com/522422702568489/posts/654193402724751;
8/20/22 2:22 PM;Jair Messias Bolsonaro; Capitão Tarcísio Gomes de Freitas, um dos maiores Ministros da Infraestrutura que o Brasil já teve, destrói narrativas e mostra o que o Governo Federal fez por São Paulo.;90745.0;5894.0;130374.0;;;211857482296579;211857482296579_653867362757355;https://www.facebook.com/522422702568489/posts/653867362757355;
8/20/22 9:47 AM;Jair Messias Bolsonaro; Resende / RJ (20/08/2022) Parte 3. TikTok JB: https://www.tiktok.com/@bolsonaromessiasjair?_t=8UzaYy95LLq&_r=1;32380.0;7524.0;51820.0;;;211857482296579;211857482296579_1097703567831606;https://www.facebook.com/522422702568489/videos/1097703567831606;
8/20/22 9:31 AM;Jair Messias Bolsonaro; Resende / RJ (20/08/2022) Parte 2. Telegram JB: https://t.me/jairbolsonarobrasil;46257.0;8169.0;68116.0;;;211857482296579;211857482296579_443990691108485;https://www.facebook.com/522422702568489/videos/443990691108485;
8/20/22 8:36 AM;Jair Messias Bolsonaro; Resende / RJ (20/08/2022) Parte 1. GETTR JB: https://gettr.com/user/jairbolsonaro;101825.0;23036.0;161946.0;;;211857482296579;211857482296579_648168266318933;https://www.facebook.com/522422702568489/videos/648168266318933;
8/20/22 8:22 AM;Jair Messias Bolsonaro;-;39639.0;2587.0;61420.0;;;211857482296579;211857482296579_653570609453697;https://www.facebook.com/522422702568489/posts/653570609453697;
8/19/22 10:31 PM;Jair Messias Bolsonaro; Se eu pedir que as pessoas bebam água regularmente:;108579.0;21617.0;283869.0;;;211857482296579;211857482296579_653290339481724;https://www.facebook.com/522422702568489/posts/653290339481724;
8/19/22 9:34 PM;Jair Messias Bolsonaro; Belo Horizonte-MG (19/08/2022). Atualizações de ações realizadas em nosso canal no Telegram: https://t.me/jairbolsonarobrasil;36914.0;9625.0;60761.0;;;211857482296579;211857482296579_785705019138447;https://www.facebook.com/522422702568489/videos/785705019138447;
8/19/22 6:33 PM;Jair Messias Bolsonaro; Inauguração do TRF-6 / Belo Horizonte-MG;57479.0;17571.0;99567.0;;;211857482296579;211857482296579_5687845304663242;https://www.facebook.com/522422702568489/videos/5687845304663242;
8/19/22 4:09 PM;Jair Messias Bolsonaro; Não adianta. Se zerarmos os homicídios - que em nosso Governo já foram reduzidos ao menor índice em mais de uma década - parte da mídia reclamará do prejuízo causado à Associação dos Assassinos e Matadores de Aluguel.;45351.0;5153.0;80416.0;;;211857482296579;211857482296579_653100076167417;https://www.facebook.com/522422702568489/posts/653100076167417;
8/19/22 8:26 AM;Jair Messias Bolsonaro; O Governo Federal zerou imposto de importação de suplementos alimentares, como whey protein, creatina, BCAA e multivitamínicos, e diversos itens de nutrição esportiva, além de reduzir de 11,2 pra 4% os impostos para diversos outros itens, como proteínas lácteas e Albumina.- "Por que não anuncia redução de imposto sobre alimentos?" Por que já anunciamos há meses! Os impostos sobre itens da cesta básica têm sido reduzidos e zerados continuamente desde 2020 para combater os efeitos do "fica em casa que a economia vê depois" e da guerra.- Carne bovina, carne de frango, farinha de trigo, café, margarina, óleo de soja, macarrão, bolachas e biscoitos, produtos de padaria e pastelaria, açúcar e muitos outros já foram incluídos em reduções passadas, assim como medicamentos, combustíveis, energia e o gás de cozinha.;57463.0;6901.0;88554.0;;;211857482296579;211857482296579_652487379562020;https://www.facebook.com/522422702568489/posts/652487379562020;
8/18/22 10:25 PM;Jair Messias Bolsonaro; Saneamento Básico: em mais uma etapa desde 2019, destinados mais recursos para continuidade de obras de esgotamento sanitário, abastecimento de água e manejo de águas pluviais nos estados do Ceará, Goiás, Mato Grosso, Mato Grosso do Sul, Paraná, Rondônia e Rio Grande do Sul.-Além do início dos investimentos históricos com a sanção do Marco do Saneamento Básico derivando em mais saúde para o povo. Passos gigantescos são dados em obras que jamais renderam votos, pois não possuem visibilidade direta ou devido a interesses que sempre estiveram por trás.;40978.0;2934.0;49356.0;;;211857482296579;211857482296579_652196516257773;https://www.facebook.com/522422702568489/posts/652196516257773;
8/18/22 7:00 PM;Jair Messias Bolsonaro; Live da semana / PR Jair Bolsonaro (18/08/2022);83184.0;39420.0;154160.0;;;211857482296579;211857482296579_5880812035280838;https://www.facebook.com/522422702568489/videos/5880812035280838;
8/18/22 5:20 PM;Jair Messias Bolsonaro; Ao contrário do que diziam, mostramos que é possível, sim, reduzir essa carga super-pesada. Basta uma política econômica eficiente e respeito com o dinheiro dos brasileiros. Essa tem sido nossa grande diferença: ao invés de se servir do povo, nós passamos a servir ao povo.- Alimentos, combustíveis, gás de cozinha, energia, medicamentos, eletrodomésticos, games, carros, motos, suplementos e mais centenas de itens: nunca tantos impostos foram reduzidos como nos últimos anos. Nosso compromisso é seguir reduzindo e zerando sempre que for possível!;70562.0;5343.0;90805.0;;;211857482296579;211857482296579_651805389630219;https://www.facebook.com/522422702568489/posts/651805389630219;
8/18/22 1:35 PM;Jair Messias Bolsonaro; São José dos Campos / São Paulo (18/08/2022). Atualizações realizadas no Telegram desta quinta-feira: https://t.me/jairbolsonarobrasil;22229.0;6083.0;37105.0;;;211857482296579;211857482296579_1305157060309614;https://www.facebook.com/522422702568489/videos/1305157060309614;
8/18/22 1:07 PM;Jair Messias Bolsonaro; São José dos Campos / São Paulo (18/08/2022) Parte 12. Baixe nosso aplicativo: https://app.bolsonaro.tv/;101856.0;23917.0;167689.0;;;211857482296579;211857482296579_1210717156445954;https://www.facebook.com/522422702568489/videos/1210717156445954;
8/18/22 12:58 PM;Jair Messias Bolsonaro; São José dos Campos / São Paulo (18/08/2022) Parte 11. Inscreva-se em nosso GETTR: https://gettr.com/user/jairbolsonaro;14428.0;1957.0;20509.0;;;211857482296579;211857482296579_775718633547396;https://www.facebook.com/522422702568489/videos/775718633547396;
8/18/22 12:45 PM;Jair Messias Bolsonaro; São José dos Campos / São Paulo (18/08/2022) Parte 10. Inscreva-se em nosso canal no Kwai: https://s.kw.ai/u/ZFnz3CZn;46786.0;9003.0;73953.0;;;211857482296579;211857482296579_801799590990822;https://www.facebook.com/522422702568489/videos/801799590990822;
8/18/22 12:45 PM;Jair Messias Bolsonaro;São José dos Campos/SP;3713.0;274.0;4443.0;;;211857482296579;211857482296579_651622222981869;https://www.facebook.com/522422702568489/posts/651622222981869;
8/18/22 12:27 PM;Jair Messias Bolsonaro; São José dos Campos / São Paulo (18/08/2022) Parte 9. Inscreva-se em nosso canal no TikTok: https://www.tiktok.com/@bolsonaromessiasjair?_t=8UwTeLuRJoM&_r=1;42390.0;5382.0;58841.0;;;211857482296579;211857482296579_1112965049651429;https://www.facebook.com/522422702568489/videos/1112965049651429;
8/18/22 12:17 PM;Jair Messias Bolsonaro; São José dos Campos / São Paulo (18/08/2022) Parte 8. Tenha acessos à informações de forma interativa para divulgar entre amigos e parentes em nosso Flickr: https://www.flickr.com/photos/fotosbolsonaro/;20218.0;1563.0;26667.0;;;211857482296579;211857482296579_607271734105295;https://www.facebook.com/522422702568489/videos/607271734105295;
8/18/22 12:14 PM;Jair Messias Bolsonaro; São José dos Campos / São Paulo (18/08/2022) Parte 7. Inscreva-se em nosso canal no YouTube: https://youtube.com/c/jbolsonaro;19966.0;1285.0;25329.0;;;211857482296579;211857482296579_1310460806362527;https://www.facebook.com/522422702568489/videos/1310460806362527;
8/18/22 12:06 PM;Jair Messias Bolsonaro; São José dos Campos / São Paulo (18/08/2022) Parte 6. Inscreva-se em nosso canal no Telegram! Informações atualizadas todos os dias: https://t.me/jairbolsonarobrasil;17564.0;1772.0;23427.0;;;211857482296579;211857482296579_1226037561582061;https://www.facebook.com/522422702568489/videos/1226037561582061;
8/18/22 11:49 AM;Jair Messias Bolsonaro; São José dos Campos / São Paulo (18/08/2022) Parte 5. Baixe nosso Aplicativo: https://app.bolsonaro.tv/;18367.0;3069.0;28288.0;;;211857482296579;211857482296579_1710851752627667;https://www.facebook.com/522422702568489/videos/1710851752627667;
8/18/22 11:44 AM;Jair Messias Bolsonaro; São José dos Campos / São Paulo (18/08/2022) Parte 4. Inscreva-se em nosso canal no TikTok: https://www.tiktok.com/@bolsonaromessiasjair?_t=8UwIK5dRfYj&_r=1;28791.0;4807.0;41700.0;;;211857482296579;211857482296579_1124398384781248;https://www.facebook.com/522422702568489/videos/1124398384781248;
8/18/22 11:42 AM;Jair Messias Bolsonaro; São José dos Campos / São Paulo (18/08/2022) Parte 3. Inscreva-se em nosso canal no LinkedIn: https://www.linkedin.com/in/jairmessiasbolsonaro;45637.0;6312.0;63654.0;;;211857482296579;211857482296579_1773677512977288;https://www.facebook.com/522422702568489/videos/1773677512977288;
8/18/22 11:21 AM;Jair Messias Bolsonaro; São José dos Campos / São Paulo (18/08/2022) Parte 2. Inscreva-se em nosso perfil no GETTR: https://gettr.com/user/jairbolsonaro;24028.0;7452.0;41231.0;;;211857482296579;211857482296579_1016045085743257;https://www.facebook.com/522422702568489/videos/1016045085743257;
8/18/22 11:09 AM;Jair Messias Bolsonaro; Visita ao Parque Tecnológico de São José dos Campos/SP (18/08/2022). Inscreva-se em nosso Kwai: https://s.kw.ai/u/bgC918Z5;16431.0;4379.0;26309.0;;;211857482296579;211857482296579_459936292675135;https://www.facebook.com/522422702568489/videos/459936292675135;
8/18/22 11:05 AM;Jair Messias Bolsonaro;Visita ao Parque Tecnológico de São José dos Campos/SP;22803.0;4386.0;34632.0;;;211857482296579;211857482296579_1191743668061385;https://www.facebook.com/522422702568489/videos/1191743668061385;
8/18/22 6:48 AM;Jair Messias Bolsonaro; Após quase 14 anos de espera pelo título da terra, Antônia Francisca e Manuel Lopes receberam o documento.- Assim como eles, mais de 370 mil famílias brasileiras receberam o título desde o início de 2019. Mais um recorde histórico.;24949.0;1830.0;33229.0;;;211857482296579;211857482296579_651156746361750;https://www.facebook.com/522422702568489/posts/651156746361750;
8/17/22 7:34 PM;Jair Messias Bolsonaro;Reunião com Prefeitos em Brasilia-DF - 17/08/2022;43620.0;10778.0;67611.0;;;211857482296579;211857482296579_436005064997269;https://www.facebook.com/522422702568489/videos/436005064997269;
8/17/22 7:05 PM;Jair Messias Bolsonaro; Curso de formação de medicina ganha novo estímulo:;21892.0;1402.0;27042.0;;;211857482296579;211857482296579_650804733063618;https://www.facebook.com/522422702568489/posts/650804733063618;
8/17/22 12:02 PM;Jair Messias Bolsonaro; O aliado do descondenado na Nicarágua persegue cristãos. Na Venezuela, fecha jornais e deixa o país mais pobre que o Haiti. Em Cuba, prende opositores e proíbe cidadãos de deixarem o país. Outros aumentam impostos e liberam drogas. Mas há quem diga que ele não apoia nada disso.- É estranho o PT esconder dos brasileiros essas relações e suas pautas mais íntimas, como a liberação das drogas e do aborto, durante o período eleitoral. Se julgam ser bandeiras tão benéficas para o Brasil, deveriam premiar, não banir, aqueles que fazem o favor de divulgá-las.;29985.0;2526.0;44307.0;;;211857482296579;211857482296579_650290219781736;https://www.facebook.com/522422702568489/posts/650290219781736;
8/17/22 8:04 AM;Jair Messias Bolsonaro; Mais um estímulo à prática ao esporte de jovens: Assinado o decreto que atualiza o rol das ENTIDADES ESPORTIVAS detentoras do direito de indicarem competições elegíveis para o recebimento da BOLSA-ATLETA NA CATEGORIA ESTUDANTIL! DECRETO 11.168/2022.- Agora, além do Comitê Olímpico do Brasil e do Comitê Paralímpico Brasileiro (CPB) a Confederação Brasileira de Desporto Escolar (CBDE) e a Confederação Brasileira de Desporto Universitário (CBDU) indicarão competições estudantis e universitárias para concessão do benefício.- Na contramão de outros governos, o estímulo à prática de esportes e sua profissionalização são destaque para o Brasil desde 2019, formando mais campeões internacionais e nacionais, cidadãos longe dos perigos de escolhas erradas e estímulo para novas carreiras direcionadas.;45894.0;1777.0;54445.0;;;211857482296579;211857482296579_650118929798865;https://www.facebook.com/522422702568489/posts/650118929798865;
8/16/22 11:10 PM;Jair Messias Bolsonaro; BRASIL ACIMA DE TUDO! DEUS ACIMA DE TODOS! 🇧🇷👍.;234790.0;19925.0;314365.0;;;211857482296579;211857482296579_649886109822147;https://www.facebook.com/522422702568489/posts/649886109822147?substory_index=609454197438359;
8/16/22 9:40 PM;Jair Messias Bolsonaro; Sem guerra e pandemia, o PT entregou o país à pior recessão de nossa história. Em meu governo, mesmo com pandemia e guerra, benefícios sociais foram ampliados, milhões de empregos foram gerados e a economia voltou a crescer. Eles quebraram o Brasil. Nós quebramos paradigmas.- Lula e Dilma deixaram para os brasileiros um país devastado, com 15 milhões de desempregados, prejuízos bilionários nas estatais e obras inacabadas, além do maior esquema de corrupção, o maior número de assassinatos e a pior década para a economia de toda a nossa História.- Em 4 anos de Bolsonaro, as estatais dão lucro, as obras abandonadas são concluídas e temos o menor número de homicídios em uma década. Nossa economia voltou a crescer, o desemprego é o menor desde o desastre petista e o número de brasileiros trabalhando bateu todos os recordes.;125367.0;9147.0;162346.0;;;211857482296579;211857482296579_649843569826401;https://www.facebook.com/522422702568489/posts/649843569826401;
